GREENHOUSE GAS SOURCE AND SINK CATEGORIES,Net CO2 emissions/removals (kt),CH4 (kt),N2O (kt),HFCs(1) (kt CO2 equivalent),PFCs(1),SF6 (kt),Sheet,Country,Year,Level,Parent_Sector
B.  Chemical industry,420.83,,0.6966,,,,Summary1.As1,KAZAKHSTAN,2017,Subsector,2.  Industrial processes and product use
C.  Metal industry,15189.3704,0.39139,,,84.05921,,Summary1.As1,KAZAKHSTAN,2017,Subsector,2.  Industrial processes and product use
D.  Non-energy products from fuels and solvent use ,158.959,,,,,,Summary1.As1,KAZAKHSTAN,2017,Subsector,2.  Industrial processes and product use
F.  Product uses as substitutes for ODS,,,,1968.387042175841,,,Summary1.As1,KAZAKHSTAN,2017,Subsector,2.  Industrial processes and product use
G.  Other product manufacture and use ,,,,,,9.196926e-05,Summary1.As1,KAZAKHSTAN,2017,Subsector,2.  Industrial processes and product use
