GREENHOUSE GAS SOURCE AND SINK CATEGORIES,Net CO2 emissions/removals (kt),CH4 (kt),N2O (kt),HFCs(1) (kt CO2 equivalent),PFCs(1),SF6 (kt),Sheet,Country,Year,Level,Parent_Sector
C.  Metal industry,1968.8582540729,7.40288e-05,,,,,Summary1.As1,FINLAND,2009,Subsector,2.  Industrial processes and product use
D.  Non-energy products from fuels and solvent use ,130.3268219344918,0.00579,0.002897,,,,Summary1.As1,FINLAND,2009,Subsector,2.  Industrial processes and product use
F.  Product uses as substitutes for ODS,,,,1335.755976365529,1.89584689246377,,Summary1.As1,FINLAND,2009,Subsector,2.  Industrial processes and product use
G.  Other product manufacture and use ,,,0.09745916328683,,,0.00042451412211,Summary1.As1,FINLAND,2009,Subsector,2.  Industrial processes and product use
H.  Other(3),,,,1.439364,1.19106504,0.000747,Summary1.As1,FINLAND,2009,Subsector,2.  Industrial processes and product use
