GREENHOUSE GAS SOURCE AND SINK CATEGORIES,Net CO2 emissions/removals (kt),CH4 (kt),N2O (kt),HFCs(1) (kt CO2 equivalent),PFCs(1),SF6 (kt),Sheet,Country,Year,Level,Parent_Sector
C.  Metal industry,2472.6959881179,8.69938e-05,,,,,Summary1.As1,FINLAND,2006,Subsector,2.  Industrial processes and product use
D.  Non-energy products from fuels and solvent use ,113.65557390514306,0.00514,0.002571,,,,Summary1.As1,FINLAND,2006,Subsector,2.  Industrial processes and product use
F.  Product uses as substitutes for ODS,,,,1272.6229990063864,2.67167869898764,,Summary1.As1,FINLAND,2006,Subsector,2.  Industrial processes and product use
G.  Other product manufacture and use ,,,0.1442554311443,,,0.00036295828926,Summary1.As1,FINLAND,2006,Subsector,2.  Industrial processes and product use
H.  Other(3),,,,1.58778512520937,1.21181904,0.000846,Summary1.As1,FINLAND,2006,Subsector,2.  Industrial processes and product use
