GREENHOUSE GAS SOURCE AND SINK CATEGORIES,Net CO2 emissions/removals (kt),CH4 (kt),N2O (kt),HFCs(1) (kt CO2 equivalent),PFCs(1),SF6 (kt),Sheet,Country,Year,Level,Parent_Sector
C.  Metal industry,2576.1613274441,9.04e-05,,,,,Summary1.As1,FINLAND,2004,Subsector,2.  Industrial processes and product use
D.  Non-energy products from fuels and solvent use ,110.11818759328,0.00513,0.002567,,,,Summary1.As1,FINLAND,2004,Subsector,2.  Industrial processes and product use
F.  Product uses as substitutes for ODS,,,,1048.6655748611302,2.21336999373995,,Summary1.As1,FINLAND,2004,Subsector,2.  Industrial processes and product use
G.  Other product manufacture and use ,,,0.14321339320308,,,0.00034653041429,Summary1.As1,FINLAND,2004,Subsector,2.  Industrial processes and product use
H.  Other(3),,,,2.21117484991729,0.70497009,0.000699,Summary1.As1,FINLAND,2004,Subsector,2.  Industrial processes and product use
