GREENHOUSE GAS SOURCE AND SINK CATEGORIES,Net CO2 emissions/removals (kt),CH4 (kt),N2O (kt),HFCs(1) (kt CO2 equivalent),PFCs(1),SF6 (kt),Sheet,Country,Year,Level,Parent_Sector
C.  Metal industry,0.1196,,,,,,Summary1.As1,DENMARK,2018,Subsector,2.  Industrial processes and product use
D.  Non-energy products from fuels and solvent use ,161.99344006193672,0.0204416423816,0.000485329776,,,,Summary1.As1,DENMARK,2018,Subsector,2.  Industrial processes and product use
F.  Product uses as substitutes for ODS,,,,541.8502182224232,0.006615165375,,Summary1.As1,DENMARK,2018,Subsector,2.  Industrial processes and product use
G.  Other product manufacture and use ,0.269849725,0.0728722945,0.067547797085,,,0.00324129475952,Summary1.As1,DENMARK,2018,Subsector,2.  Industrial processes and product use
H.  Other(3),,,,,,,Summary1.As1,DENMARK,2018,Subsector,2.  Industrial processes and product use
