GREENHOUSE GAS SOURCE AND SINK CATEGORIES,Net CO2 emissions/removals (kt),CH4 (kt),N2O (kt),HFCs(1) (kt CO2 equivalent),PFCs(1),SF6 (kt),Sheet,Country,Year,Level,Parent_Sector
C.  Metal industry,16.3642,,,,,,Summary1.As1,DENMARK,2005,Subsector,2.  Industrial processes and product use
D.  Non-energy products from fuels and solvent use ,217.55391653918448,0.021282542996,0.000834257472,,,,Summary1.As1,DENMARK,2005,Subsector,2.  Industrial processes and product use
F.  Product uses as substitutes for ODS,,,,889.173992245578,18.91581429948,,Summary1.As1,DENMARK,2005,Subsector,2.  Industrial processes and product use
G.  Other product manufacture and use ,0.15932608,0.1244889094,0.063121604177,,,0.00091415449831,Summary1.As1,DENMARK,2005,Subsector,2.  Industrial processes and product use
H.  Other(3),,,,,,,Summary1.As1,DENMARK,2005,Subsector,2.  Industrial processes and product use
