GREENHOUSE GAS SOURCE AND SINK CATEGORIES,Net CO2 emissions/removals (kt),CH4 (kt),N2O (kt),HFCs(1) (kt CO2 equivalent),PFCs(1),SF6 (kt),Sheet,Country,Year,Level,Parent_Sector
C.  Metal industry,393.4741996645,0.072478,,,26.658043535334,,Summary1.As1,ICELAND,1996,Subsector,2.  Industrial processes and product use
D.  Non-energy products from fuels and solvent use ,7.86441837247873,,,,,,Summary1.As1,ICELAND,1996,Subsector,2.  Industrial processes and product use
F.  Product uses as substitutes for ODS,,,,10.087963492376,,,Summary1.As1,ICELAND,1996,Subsector,2.  Industrial processes and product use
G.  Other product manufacture and use ,0.007695732,0.001895456295,0.0164636834,,,5.455e-05,Summary1.As1,ICELAND,1996,Subsector,2.  Industrial processes and product use
H.  Other(3),,,,,,,Summary1.As1,ICELAND,1996,Subsector,2.  Industrial processes and product use
