GREENHOUSE GAS SOURCE AND SINK CATEGORIES,Net CO2 emissions/removals (kt),CH4 (kt),N2O (kt),HFCs(1) (kt CO2 equivalent),PFCs(1),SF6 (kt),Sheet,Country,Year,Level,Parent_Sector
C.  Metal industry,348.0071320779,0.06279169,,,444.815895079545,,Summary1.As1,ICELAND,1990,Subsector,2.  Industrial processes and product use
D.  Non-energy products from fuels and solvent use ,7.20677623119413,,,,,,Summary1.As1,ICELAND,1990,Subsector,2.  Industrial processes and product use
F.  Product uses as substitutes for ODS,,,,0.31364363459,,,Summary1.As1,ICELAND,1990,Subsector,2.  Industrial processes and product use
G.  Other product manufacture and use ,0.00492595875,0.001881478374,0.020443773453,,,4.80875e-05,Summary1.As1,ICELAND,1990,Subsector,2.  Industrial processes and product use
H.  Other(3),,,,,,,Summary1.As1,ICELAND,1990,Subsector,2.  Industrial processes and product use
