GREENHOUSE GAS SOURCE AND SINK CATEGORIES,Net CO2 emissions/removals (kt),CH4 (kt),N2O (kt),HFCs(1) (kt CO2 equivalent),PFCs(1),SF6 (kt),Sheet,Country,Year,Level,Parent_Sector
C.  Metal industry,715.5572052496,0.1087,,,134.794913997225,,Summary1.As1,ICELAND,2000,Subsector,2.  Industrial processes and product use
D.  Non-energy products from fuels and solvent use ,7.824134497114,,,,,,Summary1.As1,ICELAND,2000,Subsector,2.  Industrial processes and product use
F.  Product uses as substitutes for ODS,,,,42.9882725468099,,,Summary1.As1,ICELAND,2000,Subsector,2.  Industrial processes and product use
G.  Other product manufacture and use ,0.01633850925,0.001812621693,0.016530486411,,,5.7525e-05,Summary1.As1,ICELAND,2000,Subsector,2.  Industrial processes and product use
H.  Other(3),,,,,,,Summary1.As1,ICELAND,2000,Subsector,2.  Industrial processes and product use
