GREENHOUSE GAS SOURCE AND SINK CATEGORIES,Net CO2 emissions/removals (kt),CH4 (kt),N2O (kt),HFCs(1) (kt CO2 equivalent),PFCs(1),SF6 (kt),Sheet,Country,Year,Level,Parent_Sector
C.  Metal industry,1014.435727114236,0.00809824,,,48.316986,,Summary1.As1,GREECE,1996,Subsector,2.  Industrial processes and product use
D.  Non-energy products from fuels and solvent use ,74.13865375682154,,,,,,Summary1.As1,GREECE,1996,Subsector,2.  Industrial processes and product use
F.  Product uses as substitutes for ODS,,,,76.51077244437275,,,Summary1.As1,GREECE,1996,Subsector,2.  Industrial processes and product use
G.  Other product manufacture and use ,89.03913469325907,,0.47116459966791,,,0.000154,Summary1.As1,GREECE,1996,Subsector,2.  Industrial processes and product use
H.  Other(3),,,,,,,Summary1.As1,GREECE,1996,Subsector,2.  Industrial processes and product use
