GREENHOUSE GAS SOURCE AND SINK CATEGORIES,Net CO2 emissions/removals (kt),CH4 (kt),N2O (kt),HFCs(1) (kt CO2 equivalent),PFCs(1),SF6 (kt),Sheet,Country,Year,Level,Parent_Sector
C.  Metal industry,1239.9931665601123,0.01700904,,,52.2397512,,Summary1.As1,GREECE,2003,Subsector,2.  Industrial processes and product use
D.  Non-energy products from fuels and solvent use ,44.53779270223225,,,,,,Summary1.As1,GREECE,2003,Subsector,2.  Industrial processes and product use
F.  Product uses as substitutes for ODS,,,,1292.2865206078257,28.373214384,,Summary1.As1,GREECE,2003,Subsector,2.  Industrial processes and product use
G.  Other product manufacture and use ,95.09437931712114,,0.47955649819425,,,0.000178,Summary1.As1,GREECE,2003,Subsector,2.  Industrial processes and product use
H.  Other(3),,,,,,,Summary1.As1,GREECE,2003,Subsector,2.  Industrial processes and product use
